"","order_var","article_title","n","mins","hrs"
"1279",7,"Who is Bushra Bibi, the mystical wife of Imran Khan?",22,110,1.83333333333333
"1280",8,"American lunar mission destroyed over Pacific Ocean",22,110,1.83333333333333
"1281",8,"Biden wins in New Hampshire despite ballot no-show",22,110,1.83333333333333
"1282",8,"China says US 'gravely wrong' to congratulate Taiwan leader",22,110,1.83333333333333
"1283",8,"Fake death of India actress sparks ethics debate",22,110,1.83333333333333
"1284",8,"Israel in heavy south Gaza strikes as hostages sent medicine",22,110,1.83333333333333
"1285",8,"Japan hopes sunlight can save stricken Moon lander",22,110,1.83333333333333
"1286",8,"Senegal on the brink after elections postponed",22,110,1.83333333333333
"1287",8,"Trump turns his legal battles into campaign spectacle",22,110,1.83333333333333
"1288",8,"Zelensky sacks Ukraine's commander-in-chief",22,110,1.83333333333333
"1289",9,"Clapham suspect convicted of sex offence in 2018",22,110,1.83333333333333
"1290",9,"Drone attack kills six Syrian fighters at US base",22,110,1.83333333333333
"1291",9,"Fears for farm animals stuck on ship off Australia",22,110,1.83333333333333
"1292",9,"Former pole vault world champion Barber dies aged 29",22,110,1.83333333333333
"1293",9,"India boat capsize victims 'not given life jackets'",22,110,1.83333333333333
"1294",9,"Japan hopes sunlight can save stricken Moon lander",22,110,1.83333333333333
"1295",9,"Key UN Gaza aid agency runs into diplomatic storm",22,110,1.83333333333333
"1296",9,"Namibia criticises German support for Israel over ICJ case",22,110,1.83333333333333
"1297",9,"S African DJ Black Coffee injured during flight to gig",22,110,1.83333333333333
"1298",9,"The new-style nightclub that's only open in the day",22,110,1.83333333333333
"1299",9,"Trapped orcas escape from drift ice near Japan",22,110,1.83333333333333
"1300",9,"Trump's federal trial on election meddling postponed",22,110,1.83333333333333
"1301",9,"UPS to cut 12,000 jobs after 'disappointing' year",22,110,1.83333333333333
"1302",9,"What do we know about the King's cancer diagnosis?",22,110,1.83333333333333
"1303",9,"Winter storm hits US with heavy snow and icy winds",22,110,1.83333333333333
"1304",10,"Bolts missing from door, says Boeing blowout probe",22,110,1.83333333333333
"1305",10,"Brosnan pleads not guilty to Yellowstone trespassing",22,110,1.83333333333333
"1306",10,"Fans boo as Messi fails to play in Hong Kong friendly",22,110,1.83333333333333
"1307",10,"Has great white shark newborn been caught on film?",22,110,1.83333333333333
"1308",10,"Iran's sudden strikes show just how perilous region has become",22,110,1.83333333333333
"1309",10,"Israelis tell MPs of Hamas sexual violence evidence",22,110,1.83333333333333
"1310",10,"Mining giants told to pay $9.7bn over dam disaster",22,110,1.83333333333333
"1311",10,"Russian sanctioned for Australia's worst data hack",22,110,1.83333333333333
"1312",10,"Who are the Houthi rebels attacking Red Sea ships?",22,110,1.83333333333333
"1313",1,"Iran: Air strike on Syria will not go 'unanswered'",21,105,1.75
"1314",1,"Swedish police destroy object outside Israeli embassy",21,105,1.75
"1315",2,"Billionaire Lewis pleads guilty to insider trading",21,105,1.75
"1316",2,"Iowa principal who saved pupils from shooting dies",21,105,1.75
"1317",2,"Swedish police destroy object outside Israeli embassy",21,105,1.75
"1318",2,"Yemen strikes show war in Gaza has already spread",21,105,1.75
"1319",3,"Australia axes 'golden visa' scheme for mega rich",21,105,1.75
"1320",3,"Barbie misses key Oscar nods for Gerwig and Robbie",21,105,1.75
"1321",3,"Dua Lipa: Fans don't want pop stars to be smart",21,105,1.75
"1322",3,"Grammys 2024: The highs, lows and why Swift won",21,105,1.75
"1323",3,"Iowa principal who saved pupils from shooting dies",21,105,1.75
"1324",3,"Israel calls genocide claim a distortion of truth",21,105,1.75
"1325",3,"Judge annuls Musk's 'unfathomable' $56bn Tesla pay",21,105,1.75
"1326",3,"Musk says Neuralink implanted wireless brain chip",21,105,1.75
"1327",3,"Myanmar's army is losing - and facing fire from a militant monk",21,105,1.75
"1328",3,"Rare N Korea footage shows teens sentenced over K-drama",21,105,1.75
"1329",3,"Russia: Cat thrown off train into snow found dead",21,105,1.75
"1330",3,"Second Boeing model to be inspected after blowout",21,105,1.75
"1331",3,"Snoop Dogg’s daughter speaks of shock after stroke",21,105,1.75
"1332",3,"US launches fourth round of strikes on Houthi targets",21,105,1.75
"1333",3,"US man says wait for untested execution like 'torture'",21,105,1.75
"1334",3,"Why did Iran launch strikes on its allies' territory?",21,105,1.75
"1335",4,"'Send back our husbands' - Russian women in rare protest",21,105,1.75
"1336",4,"Emma Stone: Sex scenes in Poor Things are 'honest'",21,105,1.75
"1337",4,"French actress accuses director of historical rape",21,105,1.75
"1338",4,"Israel reined in by ICJ ruling - but will it obey?",21,105,1.75
"1339",4,"Josef Fritzl could be moved to care home - reports",21,105,1.75
"1340",4,"Key takeaways from Trump's win in Iowa",21,105,1.75
"1341",4,"King Charles in hospital for prostate treatment",21,105,1.75
"1342",4,"Ryan Gosling disappointed by Barbie's Oscar snubs",21,105,1.75
"1343",4,"UK High Court throws out Trump ex-spy dossier case",21,105,1.75
"1344",4,"US approves plan for strikes on Iranian targets",21,105,1.75
"1345",4,"US condemns Iran for 'reckless' strikes on Iraq",21,105,1.75
"1346",5,"'If not Putin, then who?' - How Russians view looming elections",21,105,1.75
"1347",5,"Alabama inmate faces first nitrogen execution in US",21,105,1.75
"1348",5,"Germans mull ban on elected far-right party after scandal",21,105,1.75
"1349",5,"India PM to open grand temple on razed mosque site",21,105,1.75
"1350",5,"Iran: Air strike on Syria will not go 'unanswered'",21,105,1.75
"1351",5,"King doing 'extremely well' after diagnosis - Queen",21,105,1.75
"1352",5,"Namibia gets new leader hours after predecessor dies",21,105,1.75
"1353",5,"Netanyahu defies Biden over Palestinian state",21,105,1.75
"1354",5,"NZ MP resigns following shoplifting allegations",21,105,1.75
"1355",5,"South Africa slams Nigeria for football safety warning",21,105,1.75
"1356",5,"Spectacular arches and caves as iceberg decays",21,105,1.75
"1357",5,"Trump takes legal risk on stand in defamation trial",21,105,1.75
"1358",5,"Tucker Carlson to interview Russia's Putin",21,105,1.75
"1359",5,"William to return to work after Kate's surgery",21,105,1.75
"1360",6,"'Will you come and get me?' Gaza girl's desperate plea before losing contact",21,105,1.75
"1361",6,"Democrat leaves hospital to cast vital impeachment vote",21,105,1.75
"1362",6,"Inert nuclear missile found in US man's garage",21,105,1.75
"1363",6,"Man jailed for 50 years for defaming Thai monarchy",21,105,1.75
"1364",6,"Records broken but Barbie snubbed - 6 Oscars talking points",21,105,1.75
"1365",6,"The Emmys red carpet in pictures",21,105,1.75
"1366",6,"Ukraine 'hits Russian missile boat in Black Sea'",21,105,1.75
"1367",7,"Fashion icons assemble for Enninful's last Vogue",21,105,1.75
"1368",7,"Iran says US strikes are a 'strategic mistake'",21,105,1.75
"1369",7,"Israelis tell MPs of Hamas sexual violence evidence",21,105,1.75
"1370",7,"Lauren Boebert's ex-husband arrested in Colorado",21,105,1.75
"1371",7,"Manhunt for Clapham attack suspect continues",21,105,1.75
"1372",7,"Military-led West African states leave Ecowas",21,105,1.75
"1373",7,"Rugby star Kurtley Beale not guilty of sexual assault",21,105,1.75
"1374",7,"Shocked by far-right revelations, Germans consider ban",21,105,1.75
"1375",7,"Trump cannot speak at civil fraud trial - judge",21,105,1.75
"1376",7,"YouTube terminates TB Joshua’s official channel",21,105,1.75
"1377",8,"Adele announces 'random' Munich residency",21,105,1.75
"1378",8,"Cher's conservatorship request for son denied",21,105,1.75
"1379",8,"Democrat being investigated for spending on security",21,105,1.75
"1380",8,"How TB Joshua’s whistle-blowing daughter took on 'Daddy'",21,105,1.75
"1381",8,"Man held for murder over South Africa building fire",21,105,1.75
"1382",8,"Man sentenced to death for Japan anime studio fire",21,105,1.75
"1383",8,"Passenger opens plane door and walks on wing",21,105,1.75
"1384",8,"Rapper Killer Mike detained at Grammys ceremony",21,105,1.75
"1385",8,"Six-legged dog has operation to remove extra limbs",21,105,1.75
"1386",9,"Cyclone brings heavy rain to Reunion and Mauritius",21,105,1.75
"1387",9,"Former president of Chile dies in helicopter crash",21,105,1.75
"1388",9,"King leaves hospital as Kate recovers at home",21,105,1.75
"1389",9,"Top Palestinian envoy says UK guilty of hypocrisy",21,105,1.75
"1390",9,"Trump ordered to pay NY Times $392,000 in legal costs",21,105,1.75
"1391",9,"TV and film actor Adan Canto dies of cancer at 42",21,105,1.75
"1392",9,"Why is TikTok going crazy for Stanley water cups?",21,105,1.75
"1393",9,"Woman injured in Sydney Harbour shark attack",21,105,1.75
"1394",10,"Biden secures major endorsement in re-election bid",21,105,1.75
"1395",10,"I almost died up a mountain scattering dad's ashes",21,105,1.75
"1396",10,"Injured, hungry and alone - the Gazan children orphaned by war",21,105,1.75
"1397",10,"Iran's antisemitic speeches to UK students probed",21,105,1.75
"1398",10,"Israeli protesters hold up aid trucks to Gaza",21,105,1.75
"1399",10,"Michael Owen: 'I'd swap eyes with my son if I could'",21,105,1.75
"1400",10,"Microsoft says AI is getting deployed 'at scale'",21,105,1.75
"1401",10,"Rolling Tuscan fields among stunning travel award photos",21,105,1.75
"1402",10,"Saudi Arabia to get first alcohol shop in 70 years",21,105,1.75
"1403",10,"What do we know about the King's cancer diagnosis?",21,105,1.75
"1404",10,"Where Biden v Trump will be won and lost",21,105,1.75
"1405",10,"Why the world is watching US election so closely",21,105,1.75
"1406",1,"Orban and EU leaders to face off over Ukraine aid",20,100,1.66666666666667
"1407",1,"Pakistan condemns deadly Iranian missile strike",20,100,1.66666666666667
"1408",1,"Western officials in protest over Israel Gaza policy",20,100,1.66666666666667
"1409",2,"Georgia prosecutors in Trump case admit affair",20,100,1.66666666666667
"1410",2,"Haley calls Trump insecure for false 'birther' claims",20,100,1.66666666666667
"1411",2,"Iran admits carrying out deadly Pakistan strike",20,100,1.66666666666667
"1412",2,"Israel chooses Eurovision act amid boycott calls",20,100,1.66666666666667
"1413",2,"Prince Harry to visit King Charles in coming days",20,100,1.66666666666667
"1414",2,"Taiwan elects pro-sovereignty leader, angering Beijing",20,100,1.66666666666667
"1415",3,"'Send back our husbands' - Russian women in rare protest",20,100,1.66666666666667
"1416",3,"Climbing Everest? You need to bring your poo back",20,100,1.66666666666667
"1417",3,"Qatar 'appalled' by Netanyahu's reported criticism",20,100,1.66666666666667
"1418",3,"Two Royal Navy warships collide at Bahrain port",20,100,1.66666666666667
"1419",3,"US launches more strikes against Houthis in Yemen",20,100,1.66666666666667
"1420",3,"US voters react to Trump's commanding win in Iowa",20,100,1.66666666666667
"1421",3,"William visits Kate in hospital after surgery",20,100,1.66666666666667
"1422",4,"Captain Cook statue sawn off ahead of Australia Day",20,100,1.66666666666667
"1423",4,"German chancellor finds doppelganger in US senator",20,100,1.66666666666667
"1424",4,"King Charles diagnosed with cancer",20,100,1.66666666666667
"1425",4,"Run-DMC DJ shot by godson for revenge, court told",20,100,1.66666666666667
"1426",4,"S African DJ Black Coffee injured during flight to gig",20,100,1.66666666666667
"1427",4,"Taylor Swift deepfakes spark calls for US legislation",20,100,1.66666666666667
"1428",4,"Top Arizona Republican quits over leaked tape offer",20,100,1.66666666666667
"1429",5,"Boeing in ‘last chance saloon’, warns Emirates boss",20,100,1.66666666666667
"1430",5,"Brosnan pleads not guilty to Yellowstone trespassing",20,100,1.66666666666667
"1431",5,"Taiwan elects pro-sovereignty leader, angering Beijing",20,100,1.66666666666667
"1432",5,"US approves plan for strikes on Iranian targets",20,100,1.66666666666667
"1433",6,"'If not Putin, then who?' - How Russians view looming elections",20,100,1.66666666666667
"1434",6,"Climbing Everest? You need to bring your poo back",20,100,1.66666666666667
"1435",6,"Stunning shot of polar bear drifting to sleep wins award",20,100,1.66666666666667
"1436",6,"Temple rises from ruins of one of India’s darkest days",20,100,1.66666666666667
"1437",6,"Western officials in protest over Israel Gaza policy",20,100,1.66666666666667
"1438",7,"Andrew Scott film an 'unforgettable' look at trauma",20,100,1.66666666666667
"1439",7,"France to tighten migrant law despite court ruling",20,100,1.66666666666667
"1440",7,"Heist brothers 'should be banned from Switzerland'",20,100,1.66666666666667
"1441",7,"Inert nuclear missile found in US man's garage",20,100,1.66666666666667
"1442",7,"Liberia's new leader fails to end inauguration speech",20,100,1.66666666666667
"1443",7,"Namibia criticises German support for Israel over ICJ case",20,100,1.66666666666667
"1444",7,"One dead in shooting at Istanbul Catholic church",20,100,1.66666666666667
"1445",7,"Taylor Swift deepfakes spark calls for US legislation",20,100,1.66666666666667
"1446",7,"UN condemns Alabama nitrogen gas execution",20,100,1.66666666666667
"1447",7,"What is Tower 22 and why are US troops in Jordan?",20,100,1.66666666666667
"1448",8,"British base jumper dies after parachute fails",20,100,1.66666666666667
"1449",8,"Defamation defeat a double-edged sword for Trump",20,100,1.66666666666667
"1450",8,"Dua Lipa, Billie Eilish and SZA set to star at Grammy Awards",20,100,1.66666666666667
"1451",8,"Ex-Abercrombie CEO denies sex trafficking allegations",20,100,1.66666666666667
"1452",8,"Five US Marines missing after helicopter goes down",20,100,1.66666666666667
"1453",8,"Georgia prosecutors in Trump case admit affair",20,100,1.66666666666667
"1454",8,"Jennifer Lopez takes Bob the Builder to big screen",20,100,1.66666666666667
"1455",8,"Miss Japan steps down after tabloid exposes affair",20,100,1.66666666666667
"1456",8,"US voters react to Trump's commanding win in Iowa",20,100,1.66666666666667
"1457",8,"Where did it all go wrong for Ron DeSantis?",20,100,1.66666666666667
"1458",8,"Why did US wait to retaliate for drone attack on its troops?",20,100,1.66666666666667
"1459",9,"'Catastrophic' flood risk for drenched California",20,100,1.66666666666667
"1460",9,"Ex-Abercrombie CEO denies sex trafficking allegations",20,100,1.66666666666667
"1461",9,"German far-right met to plan 'mass deportations'",20,100,1.66666666666667
"1462",9,"How TB Joshua’s whistle-blowing daughter took on 'Daddy'",20,100,1.66666666666667
"1463",9,"Iran: Air strike on Syria will not go 'unanswered'",20,100,1.66666666666667
"1464",9,"Run-DMC DJ shot by godson for revenge, court told",20,100,1.66666666666667
"1465",9,"Ryan Gosling disappointed by Barbie's Oscar snubs",20,100,1.66666666666667
"1466",9,"Who invented butter chicken? Creamy dish centre of court battle",20,100,1.66666666666667
"1467",9,"X blocks searches for Taylor Swift on its site",20,100,1.66666666666667
"1468",10,"Apple to allow rival app stores on iPhones in EU",20,100,1.66666666666667
"1469",10,"Five Republican storylines to watch for in Iowa",20,100,1.66666666666667
"1470",10,"Foreign Office warns man running length of Africa",20,100,1.66666666666667
"1471",10,"India PM opens grand temple on razed mosque site",20,100,1.66666666666667
"1472",10,"Trump counts on evangelicals to carry him to Iowa victory",20,100,1.66666666666667
"1473",10,"US delivers 'private message' to Iran after Yemen strikes",20,100,1.66666666666667
"1474",1,"Billionaire Lewis pleads guilty to insider trading",19,95,1.58333333333333
"1475",1,"China gives detained Australian suspended death sentence",19,95,1.58333333333333
"1476",1,"Emmys 2024: The red carpet in pictures",19,95,1.58333333333333
"1477",1,"Iran seizes oil tanker near Oman - reports",19,95,1.58333333333333
"1478",1,"News channel's doctored image of MP causes anger",19,95,1.58333333333333
"1479",1,"Trump asked to pay NY Times $392,000 in legal costs",19,95,1.58333333333333
"1480",1,"UK halts aid to UN agency after Hamas attack claim",19,95,1.58333333333333
"1481",2,"Princess of Wales in hospital after abdominal surgery",19,95,1.58333333333333
"1482",2,"Ryan Gosling disappointed by Barbie's Oscar snubs",19,95,1.58333333333333
"1483",2,"UK warned of coldest January night in 14 years",19,95,1.58333333333333
"1484",3,"UK island base not suitable for migrants, UN says",19,95,1.58333333333333
"1485",4,"China gives detained Australian suspended death sentence",19,95,1.58333333333333
"1486",4,"Escape to the Country's Jonnie Irwin dies aged 50",19,95,1.58333333333333
"1487",4,"Fire on ship linked to Britain after Houthi attack",19,95,1.58333333333333
"1488",4,"Former pole vault world champion Barber dies aged 29",19,95,1.58333333333333
"1489",4,"Iran-backed group suspends attacks against US",19,95,1.58333333333333
"1490",4,"Italian culture minister probed over stolen painting",19,95,1.58333333333333
"1491",4,"US and UK hint at action after largest Red Sea attack",19,95,1.58333333333333
"1492",5,"100 days since unthinkable attack triggered devastating war",19,95,1.58333333333333
"1493",5,"Denmark's cool, Scandi proclamation felt familiar",19,95,1.58333333333333
"1494",5,"Duchess of York 'shock' at skin cancer diagnosis",19,95,1.58333333333333
"1495",5,"Five kidnapped Nigerian sisters released",19,95,1.58333333333333
"1496",5,"Inert nuclear missile found in US man's garage",19,95,1.58333333333333
"1497",5,"Namibia criticises German support for Israel over ICJ case",19,95,1.58333333333333
"1498",5,"Nigerian actor's children arrested over his medical bills",19,95,1.58333333333333
"1499",5,"The schools moving underground to keep children safe",19,95,1.58333333333333
"1500",5,"Universal Music to pull songs from TikTok",19,95,1.58333333333333
"1501",5,"Who is Trump's trial lawyer Alina Habba?",19,95,1.58333333333333
"1502",6,"Alkali attack suspect was not eligible for asylum",19,95,1.58333333333333
"1503",6,"Brits living abroad for more than 15 years get vote",19,95,1.58333333333333
"1504",6,"Dior bag furore shakes South Korea's ruling party",19,95,1.58333333333333
"1505",6,"Ecuador president defies gangs to take on the army",19,95,1.58333333333333
"1506",6,"Iowa principal who saved pupils from shooting dies",19,95,1.58333333333333
"1507",6,"King Charles diagnosed with cancer",19,95,1.58333333333333
"1508",6,"Mars crash ends Nasa helicopter Ingenuity's mission",19,95,1.58333333333333
"1509",6,"Oppenheimer eclipses Barbie in Bafta nominations",19,95,1.58333333333333
"1510",6,"Senior Tory's call for Sunak to go sparks backlash",19,95,1.58333333333333
"1511",6,"US upholds ban on sale of latest Apple watches",19,95,1.58333333333333
"1512",7,"American lunar mission destroyed over Pacific Ocean",19,95,1.58333333333333
"1513",7,"Audio of US defence secretary's 911 call released",19,95,1.58333333333333
"1514",7,"Disposable vapes to be banned for child health",19,95,1.58333333333333
"1515",7,"DPD error caused chatbot to swear at customer",19,95,1.58333333333333
"1516",7,"Hezbollah missile attack kills Israeli woman and son",19,95,1.58333333333333
"1517",7,"Tesla owners told not to drive with Apple headsets",19,95,1.58333333333333
"1518",7,"What options does US have to respond to Jordan attack?",19,95,1.58333333333333
"1519",7,"Yemen strikes show war in Gaza has already spread",19,95,1.58333333333333
"1520",8,"'If not Putin, then who?' - How Russians view looming elections",19,95,1.58333333333333
"1521",8,"25,000 now killed in Gaza, says Hamas-run ministry",19,95,1.58333333333333
"1522",8,"Auschwitz film was 'like Big Brother' in house next to camp",19,95,1.58333333333333
"1523",8,"Fierce row after sacking of ABC presenter over Gaza post",19,95,1.58333333333333
"1524",8,"Magnussen to make doping 'world record' attempt",19,95,1.58333333333333
"1525",8,"Mum and girls hurt in 'corrosive substance' attack",19,95,1.58333333333333
"1526",8,"Namibia gets new leader hours after predecessor dies",19,95,1.58333333333333
"1527",8,"Ryan Gosling disappointed by Barbie's Oscar snubs",19,95,1.58333333333333
"1528",8,"Tucker Carlson to interview Russia's Putin",19,95,1.58333333333333
"1529",8,"What is Tower 22 and why are US troops in Jordan?",19,95,1.58333333333333
"1530",8,"Woman killed, 17 hurt in Israel car-ramming attack",19,95,1.58333333333333
"1531",9,"Colombia's 'Cocaine Godmother' gets Hollywood makeover",19,95,1.58333333333333
"1532",9,"Days of Our Lives star Bill Hayes dies",19,95,1.58333333333333
"1533",9,"Defamation defeat a double-edged sword for Trump",19,95,1.58333333333333
"1534",9,"Israeli footballer flies home amid hostage plea row",19,95,1.58333333333333
"1535",9,"Nicole Kidman Hong Kong drama not shown in city",19,95,1.58333333333333
"1536",9,"Trump cannot speak at civil fraud trial - judge",19,95,1.58333333333333
"1537",9,"Unseen images of computer that helped win WW2",19,95,1.58333333333333
"1538",10,"Apple overtakes Samsung as biggest phonemaker",19,95,1.58333333333333
"1539",10,"Footballer Dani Alves's rape trial begins in Spain",19,95,1.58333333333333
"1540",10,"Four migrants die trying to cross Channel",19,95,1.58333333333333
"1541",10,"French actress accuses director of historical rape",19,95,1.58333333333333
"1542",10,"Gilgo Beach suspect charged with fourth murder",19,95,1.58333333333333
"1543",10,"Hermit crabs are 'wearing' our plastic rubbish",19,95,1.58333333333333
"1544",10,"Melania Trump's mother Amalija Knavs dies at 78",19,95,1.58333333333333
"1545",1,"First glimpse of Netflix's Andrew and Maitlis in film",18,90,1.5
"1546",1,"Kylie, Billie Eilish and Beatles win early Grammys",18,90,1.5
"1547",1,"Taiwan elects William Lai president in historic vote",18,90,1.5
"1548",1,"Top court to consider if Trump can run for president",18,90,1.5
"1549",2,"EU leaders unlock €50bn support package for Ukraine",18,90,1.5
"1550",2,"Haley beaten by 'none of the candidates' in Nevada",18,90,1.5
"1551",2,"Japan bomber may have been found after 50 years",18,90,1.5
"1552",2,"Musk says Neuralink implanted wireless brain chip",18,90,1.5
"1553",2,"Pakistan condemns deadly Iranian missile strike",18,90,1.5
"1554",2,"Russia: Cat thrown off train into snow found dead",18,90,1.5
"1555",2,"Top US court refuses to block nitrogen gas execution",18,90,1.5
"1556",2,"US delivers 'private message' to Iran after Yemen strikes",18,90,1.5
"1557",2,"Weight-loss surgeon told patient 'eat, eat, eat'",18,90,1.5
"1558",2,"Where Biden v Trump will be won and lost",18,90,1.5
"1559",2,"Will Macron's whizz-kid help fend off the far right?",18,90,1.5
"1560",2,"WWE founder accused of sex trafficking",18,90,1.5
"1561",3,"Disposable vapes to be banned for child health",18,90,1.5
"1562",3,"Haley finally gets her solo showdown with Trump",18,90,1.5
"1563",3,"Jacinda Ardern marries partner in private ceremony",18,90,1.5
"1564",3,"Kenya gas blast kills three and injures nearly 300",18,90,1.5
"1565",3,"Stunning shot of polar bear drifting to sleep wins award",18,90,1.5
"1566",3,"Taiwan elects pro-sovereignty leader, angering Beijing",18,90,1.5
"1567",3,"UN agency condemns aid halt after Hamas attack claim",18,90,1.5
"1568",3,"What is Tower 22 and why are US troops in Jordan?",18,90,1.5
"1569",4,"Five kidnapped Nigerian sisters released",18,90,1.5
"1570",4,"Judge throws out Disney's lawsuit against DeSantis",18,90,1.5
"1571",4,"Scientists clone monkey to speed medical research",18,90,1.5
"1572",4,"South Africa slams Nigeria for football safety warning",18,90,1.5
"1573",4,"US voters react to Trump's commanding win in Iowa",18,90,1.5
"1574",4,"William says public sympathy 'means a great deal'",18,90,1.5
"1575",5,"'Send back our husbands' - Russian women in rare protest",18,90,1.5
"1576",5,"BBC confronts man who abused boy in secretive Christian church",18,90,1.5
"1577",5,"Donald Trump scores huge win in Nevada caucus",18,90,1.5
"1578",5,"Drone attack kills six Syrian fighters at US base",18,90,1.5
"1579",5,"Fast fashion helps fuel blazing kilns where workers faint from heat",18,90,1.5
"1580",5,"Hamas responds to proposed Gaza ceasefire plan",18,90,1.5
"1581",5,"Key UN Gaza aid agency runs into diplomatic storm",18,90,1.5
"1582",5,"Net closes in on vigilante destroyer of Italy's speed cameras",18,90,1.5
"1583",5,"Netflix password crackdown fuels sign-up surge",18,90,1.5
"1584",5,"Rio declares health emergency days before Carnival",18,90,1.5
"1585",5,"Three US soldiers killed in Jordan attack named",18,90,1.5
"1586",5,"US drone kills Iran-backed militia leader in Baghdad",18,90,1.5
"1587",5,"US son allegedly shot and beheaded dad before rant",18,90,1.5
"1588",5,"Warning over children using viral skincare products",18,90,1.5
"1589",5,"What options does US have to respond to Jordan attack?",18,90,1.5
"1590",6,"Canadian 'poison killer' to head straight to trial",18,90,1.5
"1591",6,"Downed Russian plane leaves unanswered questions",18,90,1.5
"1592",6,"Five takeaways from the Haley-DeSantis debate",18,90,1.5
"1593",6,"Halle Berry's film shelved by Netflix - US media",18,90,1.5
"1594",6,"Harry and Meghan at Marley film Jamaican premiere",18,90,1.5
"1595",6,"How London hotel sting caught Swiss museum heist thieves",18,90,1.5
"1596",6,"Imran Khan given second jail sentence in two days",18,90,1.5
"1597",6,"Iran: Air strike on Syria will not go 'unanswered'",18,90,1.5
"1598",6,"Is North Korea's leader actually considering war?",18,90,1.5
"1599",6,"Josef Fritzl could be moved to care home - reports",18,90,1.5
"1600",6,"Namibia gets new leader hours after predecessor dies",18,90,1.5
"1601",6,"One name dominant as Iowa voters kick off 2024 race",18,90,1.5
"1602",6,"Spears seems to apologise to Timberlake over book",18,90,1.5
