"","order_var","article_title","n","mins","hrs"
"1",1,"Twins separated and sold at birth reunited by TikTok",165,825,13.75
"2",1,"Swedish alarm after defence chiefs' war warning",158,790,13.1666666666667
"3",1,"Protesters throw soup at Mona Lisa painting",139,695,11.5833333333333
"4",2,"Twins separated and sold at birth reunited by TikTok",137,685,11.4166666666667
"5",1,"Netanyahu publicly rejects US push for Palestinian state",136,680,11.3333333333333
"6",1,"King Charles diagnosed with cancer",135,675,11.25
"7",1,"No more easy deals for Russian convicts freed to fight",135,675,11.25
"8",1,"US delivers 'private message' to Iran after Yemen strikes",133,665,11.0833333333333
"9",1,"World's largest cruise ship sets sail from Miami",133,665,11.0833333333333
"10",1,"Oscars 2024: List of nominations in full",127,635,10.5833333333333
"11",1,"Huge ancient city found in the Amazon",124,620,10.3333333333333
"12",1,"Putin takes charge as Carlson gives free rein to Kremlin",123,615,10.25
"13",2,"Christie exits 2024 race with parting shot at Trump",122,610,10.1666666666667
"14",2,"Stunning shot of polar bear drifting to sleep wins award",120,600,10
"15",4,"Iran says US strikes are a 'strategic mistake'",120,600,10
"16",2,"Huge galaxy ring challenges thinking on universe",118,590,9.83333333333333
"17",1,"Russia risked lives in downed plane, says Zelensky",116,580,9.66666666666667
"18",1,"Imran Khan and wife jailed for illegal marriage",112,560,9.33333333333333
"19",2,"Duchess of York diagnosed with skin cancer",112,560,9.33333333333333
"20",3,"UK to loan back Ghana's looted 'crown jewels'",111,555,9.25
"21",1,"US and UK launch fresh strikes on Houthis",110,550,9.16666666666667
"22",3,"Shackled woman in Hungary court sparks Italy anger",110,550,9.16666666666667
"23",2,"What does it mean for William, Harry and the other royals?",109,545,9.08333333333333
"24",1,"FBI investigation after ex-A&F boss sex claims",105,525,8.75
"25",2,"Barbie misses key Oscar nods for Gerwig and Robbie",104,520,8.66666666666667
"26",2,"US approves plan for strikes on Iranian targets",104,520,8.66666666666667
"27",2,"Cancer doctor takes gamble to treat his brain tumour",103,515,8.58333333333333
"28",6,"What we know about US strikes in Iraq and Syria",103,515,8.58333333333333
"29",1,"Adele announces 'random' Munich residency",101,505,8.41666666666667
"30",3,"Dancer with allergy eats mislabelled cookie and dies",101,505,8.41666666666667
"31",3,"What does it mean for William, Harry and the other royals?",100,500,8.33333333333333
"32",10,"Liberia's new leader fails to end inauguration speech",100,500,8.33333333333333
"33",1,"Judge blocks Musk's 'unfathomable' $56bn Tesla pay",99,495,8.25
"34",2,"Judge threatens to kick Trump out of defamation trial",99,495,8.25
"35",2,"Passenger opens plane door and walks on wing",99,495,8.25
"36",1,"Carroll to spend $83m on 'something Trump hates'",98,490,8.16666666666667
"37",2,"Is North Korea's leader actually considering war?",98,490,8.16666666666667
"38",6,"Israeli war leader challenges Netanyahu over Gaza",98,490,8.16666666666667
"39",1,"Navy Seals presumed dead after anti-Houthi mission",97,485,8.08333333333333
"40",2,"An eccentric Danish queen abdicates - will others follow?",97,485,8.08333333333333
"41",5,"Did bodybuilding bring on my early perimenopause?",97,485,8.08333333333333
"42",1,"Trump's failed immunity appeal is a strategic win",95,475,7.91666666666667
"43",9,"Nigerian actor's children arrested over his medical bills",95,475,7.91666666666667
"44",8,"Hunt to uncover story of mysterious shipwreck",94,470,7.83333333333333
"45",2,"Inert nuclear missile found in US man's garage",93,465,7.75
"46",1,"'Drugged, robbed, killed': One city's deadly dating trap",92,460,7.66666666666667
"47",1,"Key Israeli war leader challenges Netanyahu over Gaza strategy",92,460,7.66666666666667
"48",1,"They were Israel's 'eyes on the border' - their warnings went unheard",90,450,7.5
"49",2,"No more easy deals for Russian convicts freed to fight",90,450,7.5
"50",8,"Dua Lipa, Billie Eilish and SZA to star at Grammy Awards",90,450,7.5
"51",9,"Hunt to uncover story of mysterious shipwreck",90,450,7.5
"52",1,"Taylor Swift makes history at the Grammy Awards",89,445,7.41666666666667
"53",2,"Jacinda Ardern marries partner in private ceremony",89,445,7.41666666666667
"54",2,"Margot Robbie comments on best actress Oscar snub",89,445,7.41666666666667
"55",3,"They fled as lava spilled into town - and they may never return",89,445,7.41666666666667
"56",4,"Inert nuclear missile found in US man's garage",89,445,7.41666666666667
"57",3,"Taylor Swift deepfakes spark calls for US legislation",88,440,7.33333333333333
"58",4,"Warning over children using viral skincare products",88,440,7.33333333333333
"59",4,"'We're the country of beef, but we can only afford chicken'",87,435,7.25
"60",4,"Defamation defeat a double-edged sword for Trump",87,435,7.25
"61",6,"Did bodybuilding bring on my early perimenopause?",87,435,7.25
"62",7,"Rule, Britannia! is uncomfortable, cellist says",87,435,7.25
"63",1,"Biden says he has decided US response to Jordan attack",86,430,7.16666666666667
"64",2,"Melania Trump gives eulogy at mother's funeral",85,425,7.08333333333333
"65",3,"Who are the Houthi rebels attacking Red Sea ships?",84,420,7
"66",2,"Huge ancient city found in the Amazon",83,415,6.91666666666667
"67",2,"UN agency condemns aid halt after Hamas attack claim",83,415,6.91666666666667
"68",3,"Alec Baldwin charged again in fatal Rust shooting",83,415,6.91666666666667
"69",4,"Hamas responds to proposed Gaza ceasefire plan",83,415,6.91666666666667
"70",4,"What do we know about the King's cancer diagnosis?",83,415,6.91666666666667
"71",5,"Deadly blast hits market in Russia-held Ukraine city",83,415,6.91666666666667
"72",1,"Miss Japan steps down after tabloid exposes affair",82,410,6.83333333333333
"73",1,"Stunning shot of polar bear drifting to sleep wins award",82,410,6.83333333333333
"74",2,"US man says wait for untested execution like 'torture'",81,405,6.75
"75",4,"New atom-smasher could spark physics revolution",81,405,6.75
"76",1,"Clapham suspect convicted of sex offence in 2018",80,400,6.66666666666667
"77",1,"The cancer doctor trying to stop his brain tumour killing him",80,400,6.66666666666667
"78",3,"Ex-minister of secretive sect admits child abuse",80,400,6.66666666666667
"79",3,"Mother convicted for failing to stop school shooting",80,400,6.66666666666667
"80",4,"Japan lands on Moon but glitch threatens mission",80,400,6.66666666666667
"81",4,"Trump's federal trial on election meddling postponed",80,400,6.66666666666667
"82",10,"Nigerian actor's children arrested over his medical bills",80,400,6.66666666666667
"83",1,"News outlet's doctored MP photo causes sexism fury",79,395,6.58333333333333
"84",1,"Qatar 'appalled' by Netanyahu's reported criticism",79,395,6.58333333333333
"85",1,"Ron DeSantis quits presidential race and backs Trump",79,395,6.58333333333333
"86",4,"Protesters throw soup at Mona Lisa painting",79,395,6.58333333333333
"87",5,"Gustav Klimt portrait found after almost 100 years",79,395,6.58333333333333
"88",8,"Baldwin pleads not guilty to involuntary manslaughter",79,395,6.58333333333333
"89",1,"US drone kills Iran-backed militia leader in Baghdad",78,390,6.5
"90",3,"British brothers raided Swiss museum 'to clear a debt'",78,390,6.5
"91",1,"William visits Kate in hospital after surgery",77,385,6.41666666666667
"92",2,"Putin says deal can be reached to free US reporter",77,385,6.41666666666667
"93",3,"Protesters throw soup at Mona Lisa painting",77,385,6.41666666666667
"94",8,"Nigerian actor's children arrested over his medical bills",77,385,6.41666666666667
"95",3,"Death in the Channel - what led a boy to make fatal journey?",76,380,6.33333333333333
"96",4,"Downed Russian plane leaves unanswered questions",76,380,6.33333333333333
"97",8,"Why did a propaganda network steal her face?",76,380,6.33333333333333
"98",1,"Trump must pay $83.3m for defaming E Jean Carroll",75,375,6.25
"99",5,"Elmo responds to 'world is on fire' angst",75,375,6.25
"100",5,"One-time giant of African air travel mounts comeback",75,375,6.25
"101",5,"Three wounded in Paris train station knife attack",75,375,6.25
"102",7,"Taiwan just chose a president China loathes. What now?",75,375,6.25
"103",9,"Taylor Swift deepfakes spark calls for US legislation",75,375,6.25
"104",1,"Cancer doctor takes gamble to treat his brain tumour",74,370,6.16666666666667
"105",1,"Oil tanker on fire after Houthi missile attack, firm says",74,370,6.16666666666667
"106",2,"They fled as lava spilled into town - and they may never return",74,370,6.16666666666667
"107",2,"They were Israel's 'eyes on the border' - their warnings went unheard",74,370,6.16666666666667
"108",5,"Nikki Haley asks for Secret Service protection",74,370,6.16666666666667
"109",6,"Tough choices for Israel in US's Middle East vision",74,370,6.16666666666667
"110",1,"Three US troops killed in Middle East drone attack",73,365,6.08333333333333
"111",2,"Russian 'ultra-patriot' jailed after insulting Putin",73,365,6.08333333333333
"112",10,"Does Germany’s economy need more than a cup of coffee?",73,365,6.08333333333333
"113",2,"'My memory is fine' - Biden hits back at special counsel",72,360,6
"114",1,"Massive winter US storm expected to hit millions",71,355,5.91666666666667
"115",1,"Ukraine says it shot down Russian spy plane",71,355,5.91666666666667
"116",5,"New Iceland eruption triggers state of emergency",71,355,5.91666666666667
"117",9,"Twins separated and sold at birth reunited by TikTok",71,355,5.91666666666667
"118",1,"Alabama carries out first US nitrogen gas execution",70,350,5.83333333333333
"119",2,"Grammy Awards red carpet and ceremony in pictures",70,350,5.83333333333333
"120",3,"Cockpit window crack forces ANA Boeing to turn back",70,350,5.83333333333333
"121",3,"In Ukraine's river war, drones mean nowhere is safe",70,350,5.83333333333333
"122",3,"US and UK hint at action after largest Red Sea attack",70,350,5.83333333333333
"123",1,"Kate in hospital as King to get prostate treatment",69,345,5.75
"124",4,"Nearly 90 dead after fierce winter storms strike US",69,345,5.75
"125",5,"US convicts Russian man who flew to LA without passport",69,345,5.75
"126",6,"BBC's Glenn Campbell: My brain cancer diagnosis was a total shock",69,345,5.75
"127",9,"The Emmys red carpet in pictures",69,345,5.75
"128",1,"They were Israel's eyes on the border - but their Hamas warnings went unheard",68,340,5.66666666666667
"129",2,"Haley finally gets her solo showdown with Trump",68,340,5.66666666666667
"130",4,"Trump takes legal risk on stand in defamation trial",68,340,5.66666666666667
"131",6,"100 days since unthinkable attack triggered devastating war",68,340,5.66666666666667
"132",8,"Musician Jelly Roll pushes for anti-fentanyl bill",68,340,5.66666666666667
"133",8,"The Emmys red carpet in pictures",68,340,5.66666666666667
"134",5,"'Say you're sorry': Russia's trend for humiliating videos",67,335,5.58333333333333
"135",5,"British base jumper dies after parachute fails",67,335,5.58333333333333
"136",6,"UK considering recognising Palestine state - Cameron",67,335,5.58333333333333
"137",2,"Boeing in ‘last chance saloon’, warns Emirates boss",66,330,5.5
"138",3,"Ukraine drones hit St Petersburg gas terminal",66,330,5.5
"139",6,"Bali bomb families face accused at Guantanamo Bay",66,330,5.5
"140",8,"Chinese mafia bosses behind scam centres arrested",66,330,5.5
"141",5,"Bali bomb families face accused at Guantanamo Bay",65,325,5.41666666666667
"142",6,"New Iceland eruption triggers state of emergency",65,325,5.41666666666667
"143",10,"Stunning shot of polar bear drifting to sleep wins award",65,325,5.41666666666667
"144",1,"Jacinda Ardern marries partner in private ceremony",64,320,5.33333333333333
"145",1,"Zuckerberg apologises to families in fiery Senate hearing",64,320,5.33333333333333
"146",2,"Netanyahu rejects Hamas's proposed ceasefire terms",64,320,5.33333333333333
"147",4,"World's largest cruise ship sets sail from Miami",64,320,5.33333333333333
"148",5,"'The unstoppable wars have destroyed our lives'",64,320,5.33333333333333
"149",5,"Swedish alarm after defence chiefs' war warning",64,320,5.33333333333333
"150",6,"'Say you're sorry': Russia's trend for humiliating videos",64,320,5.33333333333333
"151",5,"American lunar mission destroyed over Pacific Ocean",63,315,5.25
"152",10,"Argentina expels family of Ecuador gang leader",63,315,5.25
"153",1,"'My memory is fine' - Biden hits back at special counsel",62,310,5.16666666666667
"154",1,"Georgia prosecutors in Trump case admit affair",62,310,5.16666666666667
"155",1,"World's largest cruise ship to set sail from Miami",62,310,5.16666666666667
"156",2,"News outlet's doctored MP photo causes sexism fury",62,310,5.16666666666667
"157",3,"Huge galaxy ring challenges thinking on universe",62,310,5.16666666666667
"158",3,"Shock as Hunter Biden attends House contempt hearing",62,310,5.16666666666667
"159",8,"Why is TikTok going crazy for Stanley water cups?",62,310,5.16666666666667
"160",2,"Japan Moon lander wakes up and resumes mission",61,305,5.08333333333333
"161",2,"Namibia President Hage Geingob dies aged 82",61,305,5.08333333333333
"162",2,"UK halts aid to UN agency after Hamas attack claim",61,305,5.08333333333333
"163",2,"William visits Kate in hospital after surgery",61,305,5.08333333333333
"164",3,"Germans mull ban on elected far-right party after scandal",61,305,5.08333333333333
"165",4,"They fled as lava spilled into town - and they may never return",61,305,5.08333333333333
"166",4,"US sanctions Israeli settlers over West Bank violence",61,305,5.08333333333333
"167",5,"Adidas says it plans to sell remaining Yeezy stock",61,305,5.08333333333333
"168",5,"WWE boss accused of sex trafficking",61,305,5.08333333333333
"169",10,"Taylor Swift deepfakes spark calls for US legislation",61,305,5.08333333333333
"170",1,"Huge galaxy ring challenges thinking on universe",60,300,5
"171",2,"Asia's most eligible prince formally marries in Brunei",60,300,5
"172",2,"Trump asked to pay NY Times $392,000 in legal costs",60,300,5
"173",3,"Defamation defeat a double-edged sword for Trump",60,300,5
"174",3,"Video released of search for Clapham attack suspect",60,300,5
"175",4,"Three US soldiers killed in Jordan attack named",60,300,5
"176",6,"Japan bomber may have been found after 50 years",60,300,5
"177",7,"Young Austrian heiress reveals €25m giveaway plan",60,300,5
"178",9,"Finnish artists want Israel barred from Eurovision",60,300,5
"179",10,"Finnish artists want Israel barred from Eurovision",60,300,5
"180",2,"What Trump's dominant win means for White House race",59,295,4.91666666666667
"181",3,"Yemen strikes show war in Gaza has already spread",59,295,4.91666666666667
"182",4,"Snoop Dogg’s daughter speaks of shock after stroke",59,295,4.91666666666667
"183",4,"Swedish alarm after defence chiefs' war warning",59,295,4.91666666666667
"184",5,"China says US 'gravely wrong' to congratulate Taiwan leader",59,295,4.91666666666667
"185",6,"I noticed a bulging lump sensation in my vagina",59,295,4.91666666666667
"186",9,"US son allegedly shot and beheaded dad before rant",59,295,4.91666666666667
"187",1,"Former CIA hacker sentenced to 40 years in prison",58,290,4.83333333333333
"188",2,"Crisis-hit China Evergrande ordered to liquidate",58,290,4.83333333333333
"189",2,"How Swiss museum heist was foiled by sting at London hotel",58,290,4.83333333333333
"190",2,"Rare N Korea footage shows teens sentenced over K-drama",58,290,4.83333333333333
"191",2,"Trump 'unleashed' followers on Carroll, says lawyer",58,290,4.83333333333333
"192",3,"Japan lands on Moon but glitch threatens mission",58,290,4.83333333333333
"193",3,"Liberia's new leader fails to end inauguration speech",58,290,4.83333333333333
"194",3,"What do we know about the King's cancer diagnosis?",58,290,4.83333333333333
"195",3,"World's largest cruise ship sets sail from Miami",58,290,4.83333333333333
"196",4,"Taiwan elects pro-sovereignty leader, angering Beijing",58,290,4.83333333333333
"197",5,"Six-legged dog has operation to remove extra limbs",58,290,4.83333333333333
"198",7,"100 days since unthinkable attack triggered devastating war",58,290,4.83333333333333
"199",10,"The new-style nightclub that's only open in the day",58,290,4.83333333333333
"200",2,"Alabama carries out first nitrogen gas execution",57,285,4.75
"201",4,"'We are surrounded': Guarding the Middle East's most dangerous border",57,285,4.75
"202",7,"Tucker Carlson interviews Russia's Putin - Kremlin",57,285,4.75
"203",8,"'Drugged, robbed, killed': One city's deadly dating trap",57,285,4.75
"204",10,"Death of US troops ratchets up pressure on Biden",57,285,4.75
"205",3,"Hamas sets out three-stage plan for ceasefire deal",56,280,4.66666666666667
"206",3,"Namibia President Hage Geingob dies aged 82",56,280,4.66666666666667
"207",4,"BBC's Glenn Campbell: My brain cancer diagnosis was a total shock",56,280,4.66666666666667
"208",5,"Is North Korea's leader actually considering war?",56,280,4.66666666666667
"209",5,"Scientists crack mystery of how MS gene spread",56,280,4.66666666666667
"210",5,"Why did US wait to retaliate for drone attack on its troops?",56,280,4.66666666666667
"211",7,"What we know about US strikes in Iraq and Syria",56,280,4.66666666666667
"212",9,"One name dominant as Iowa voters kick off 2024 race",56,280,4.66666666666667
"213",10,"US teen hailed after saving baby from electrocution",56,280,4.66666666666667
"214",1,"Brunei's 'hot prince' formally marries in ceremony",55,275,4.58333333333333
"215",1,"Israel says 24 soldiers killed in Gaza in one day",55,275,4.58333333333333
"216",2,"Biden says he has decided US response to Jordan attack",55,275,4.58333333333333
"217",2,"US inmate hours away from first nitrogen execution",55,275,4.58333333333333
"218",4,"Two Royal Navy warships collide at Bahrain port",55,275,4.58333333333333
"219",7,"Brazen van heists bring terror to South Africa’s roads",55,275,4.58333333333333
"220",7,"Dua Lipa, Billie Eilish and SZA set to star at Grammy Awards",55,275,4.58333333333333
"221",9,"Fans boo as Messi fails to play in Hong Kong friendly",55,275,4.58333333333333
"222",9,"Stunning shot of polar bear drifting to sleep wins award",55,275,4.58333333333333
"223",10,"Western officials in protest over Israel Gaza policy",55,275,4.58333333333333
"224",1,"Putin challenger barred from Russia's election",54,270,4.5
"225",2,"US and UK repel largest Houthi attack in Red Sea",54,270,4.5
"226",5,"Five takeaways from the Haley-DeSantis debate",54,270,4.5
"227",6,"At least half of Gaza buildings damaged or destroyed, new analysis shows",54,270,4.5
"228",6,"Who invented butter chicken? Creamy dish centre of court battle",54,270,4.5
"229",7,"'I regret posting online that I was Madeleine McCann'",54,270,4.5
"230",9,"'I regret posting online that I was Madeleine McCann'",54,270,4.5
"231",9,"Iran's sudden strikes show just how perilous region has become",54,270,4.5
"232",1,"Princess of Wales in hospital after abdominal surgery",53,265,4.41666666666667
"233",1,"Six held over plot to disrupt London Stock Exchange",53,265,4.41666666666667
"234",2,"Alec Baldwin charged again in fatal Rust shooting",53,265,4.41666666666667
"235",3,"New Iceland eruption triggers state of emergency",53,265,4.41666666666667
"236",4,"China says US 'gravely wrong' to congratulate Taiwan leader",53,265,4.41666666666667
"237",4,"Illegal New York synagogue tunnel leads to 9 arrests",53,265,4.41666666666667
"238",5,"'I just love you': Trump challengers fall in line",53,265,4.41666666666667
"239",5,"BBC's Glenn Campbell: My brain cancer diagnosis was a total shock",53,265,4.41666666666667
"240",5,"Top Arizona Republican quits over leaked tape offer",53,265,4.41666666666667
"241",6,"AI to hit 40% of jobs and worsen inequality, IMF says",53,265,4.41666666666667
"242",8,"Huge ancient city found in the Amazon",53,265,4.41666666666667
"243",8,"Taylor Swift deepfakes spark calls for US legislation",53,265,4.41666666666667
"244",9,"Ghana court sentences six coup plotters to death",53,265,4.41666666666667
"245",9,"Philippine leader defends taking helicopter to gig",53,265,4.41666666666667
"246",10,"'I just love you': Trump challengers fall in line",53,265,4.41666666666667
"247",2,"Iran security officials killed 'in Israeli strike'",52,260,4.33333333333333
"248",2,"Israel officials want Gaza destruction, court told",52,260,4.33333333333333
"249",2,"Trial to cover Elizabeth line 'ghost' marks",52,260,4.33333333333333
"250",3,"Inert nuclear missile found in US man's garage",52,260,4.33333333333333
"251",4,"India PM to open grand temple on razed mosque site",52,260,4.33333333333333
"252",4,"Is North Korea's leader actually considering war?",52,260,4.33333333333333
"253",4,"Liberia's new leader fails to end inauguration speech",52,260,4.33333333333333
"254",4,"Weight-loss surgeon told patient 'eat, eat, eat'",52,260,4.33333333333333
"255",5,"Doomsday Clock stays at 90 seconds to midnight",52,260,4.33333333333333
"256",5,"Fierce row after sacking of ABC presenter over Gaza post",52,260,4.33333333333333
"257",6,"Disgraced singer Gary Glitter refused jail release",52,260,4.33333333333333
"258",7,"Captain Cook statue sawn off ahead of Australia Day",52,260,4.33333333333333
"259",7,"E Jean Carroll says Trump shattered her reputation",52,260,4.33333333333333
"260",9,"Why did US wait to retaliate for drone attack on its troops?",52,260,4.33333333333333
"261",1,"Israeli war leader challenges Netanyahu over Gaza",51,255,4.25
"262",2,"Oil tanker on fire after Houthi missile attack, firm says",51,255,4.25
"263",3,"'Say you're sorry': Russia's trend for humiliating videos",51,255,4.25
"264",3,"Boy with IQ of 162 says football comes first",51,255,4.25
"265",3,"No more easy deals for Russian convicts freed to fight",51,255,4.25
"266",3,"Schwarzenegger detained over tax for luxury watch",51,255,4.25
"267",4,"Pakistan says children killed in Iranian strike",51,255,4.25
"268",6,"Illegal New York synagogue tunnel leads to 9 arrests",51,255,4.25
"269",9,"UK forces not ready for intensive war, MPs warn",51,255,4.25
"270",10,"Maignan and Milan walk off after alleged racist abuse",51,255,4.25
"271",10,"Who invented butter chicken? Creamy dish centre of court battle",51,255,4.25
"272",2,"Rocky star Carl Weathers dies aged 76",50,250,4.16666666666667
"273",3,"Christie exits 2024 race with parting shot at Trump",50,250,4.16666666666667
"274",3,"Kate in hospital as King to get prostate treatment",50,250,4.16666666666667
"275",4,"Did bodybuilding bring on my early perimenopause?",50,250,4.16666666666667
"276",5,"Former CIA hacker sentenced to 40 years in prison",50,250,4.16666666666667
"277",6,"Polish police arrest MPs in presidential palace",50,250,4.16666666666667
"278",6,"US woman gets 26 years for mother's 'suitcase murder'",50,250,4.16666666666667
"279",7,"Dua Lipa, Billie Eilish and SZA to star at Grammy Awards",50,250,4.16666666666667
"280",10,"An eccentric Danish queen abdicates - will others follow?",50,250,4.16666666666667
"281",1,"Grammys 2024: The highs, lows and why Swift won",49,245,4.08333333333333
"282",3,"New atom-smasher could spark physics revolution",49,245,4.08333333333333
"283",3,"US condemns Iran for 'reckless' strikes on Iraq",49,245,4.08333333333333
"284",5,"Yes or snow? Reese Witherspoon's viral brew divides opinion",49,245,4.08333333333333
"285",7,"Post Office threatened BBC over whistleblower",49,245,4.08333333333333
"286",8,"Biden says US strikes have not stopped Houthi attacks",49,245,4.08333333333333
"287",8,"Police failed to respond to 999 call from deaths house",49,245,4.08333333333333
"288",8,"Why the e-bike boom is raising fire fears",49,245,4.08333333333333
"289",10,"US son allegedly shot and beheaded dad before rant",49,245,4.08333333333333
"290",2,"Germans mull ban on elected far-right party after scandal",48,240,4
"291",2,"Ukraine says it has uncovered major arms corruption",48,240,4
"292",3,"Fierce row after sacking of ABC presenter over Gaza post",48,240,4
"293",3,"I noticed a bulging lump sensation in my vagina",48,240,4
"294",3,"Is North Korea's leader actually considering war?",48,240,4
"295",3,"Russian poet and Putin critic Lev Rubinstein dies after car crash",48,240,4
"296",4,"Clapham suspect convicted of sex offence in 2018",48,240,4
"297",5,"Haley calls Trump insecure for false 'birther' claims",48,240,4
"298",5,"US upholds ban on sale of latest Apple watches",48,240,4
"299",6,"China warns against 'exotic beauty' spy traps",48,240,4
"300",6,"Iran says US strikes are a 'strategic mistake'",48,240,4
"301",6,"Tucker Carlson interviews Russia's Putin - Kremlin",48,240,4
"302",7,"One name dominant as Iowa voters kick off 2024 race",48,240,4
"303",7,"Where did it all go wrong for Ron DeSantis?",48,240,4
"304",8,"Drone attack kills six Syrian fighters at US base",48,240,4
"305",10,"Colombia's 'Cocaine Godmother' gets Hollywood makeover",48,240,4
"306",2,"Houthi missile hits US-owned cargo ship off Yemen",47,235,3.91666666666667
"307",3,"Israelis tell MPs of Hamas sexual violence evidence",47,235,3.91666666666667
"308",3,"Where Biden v Trump will be won and lost",47,235,3.91666666666667
"309",4,"How London hotel sting caught Swiss museum heist thieves",47,235,3.91666666666667
"310",4,"Israel accused of targeting civilians in deadly West Bank strike",47,235,3.91666666666667
"311",5,"Benzema files defamation suit against French minister",47,235,3.91666666666667
"312",6,"Biden vows border 'shut down' if Congress passes deal",47,235,3.91666666666667
"313",7,"I noticed a bulging lump sensation in my vagina",47,235,3.91666666666667
"314",8,"The Japanese firm at the heart of the Horizon scandal",47,235,3.91666666666667
"315",10,"'God gave us Trump' - evangelicals key in Iowa vote",47,235,3.91666666666667
"316",10,"Canada sets two-year cap on foreign students",47,235,3.91666666666667
"317",1,"Controversy after Ukrainian-born model crowned Miss Japan",46,230,3.83333333333333
