"","order_var","article_title","n","mins","hrs"
"3571",8,"Iowa principal who saved pupils from shooting dies",6,30,0.5
"3572",8,"Iran says US strikes are a 'strategic mistake'",6,30,0.5
"3573",8,"Israel and Hamas reach agreement on Gaza aid",6,30,0.5
"3574",8,"Israelis tell MPs of Hamas sexual violence evidence",6,30,0.5
"3575",8,"Judge annuls Musk's 'unfathomable' $56bn Tesla pay",6,30,0.5
"3576",8,"Judge threatens to kick Trump out of defamation trial",6,30,0.5
"3577",8,"King seen for first time since cancer announcement",6,30,0.5
"3578",8,"LA Innocence Project takes on famous US murder case",6,30,0.5
"3579",8,"Liberia moves from youngest elected leader to oldest",6,30,0.5
"3580",8,"Mauritius assesses damage after Cyclone Belal",6,30,0.5
"3581",8,"Misinformation spreads in China on ‘civil war’ in Texas",6,30,0.5
"3582",8,"Mother of killed Israeli calls Hamas videos 'psychological warfare'",6,30,0.5
"3583",8,"Nations receiving US arms told to abide by laws of war",6,30,0.5
"3584",8,"Nigerian monarch shot dead and wife kidnapped",6,30,0.5
"3585",8,"S Africa's ANC suspends Zuma after new party launch",6,30,0.5
"3586",8,"Shangri-Las lead singer Mary Weiss dies aged 75",6,30,0.5
"3587",8,"Succession, Beef and The Bear sweep Emmy Awards",6,30,0.5
"3588",8,"Top Palestinian envoy says UK guilty of hypocrisy",6,30,0.5
"3589",8,"Trump, Haley and DeSantis make final pitches in frozen Iowa",6,30,0.5
"3590",8,"TV and film actor Adan Canto dies of cancer at 42",6,30,0.5
"3591",8,"Uber Eats ad criticised for peanut allergy joke",6,30,0.5
"3592",8,"UK island base not suitable for migrants, UN says",6,30,0.5
"3593",8,"Ukraine drones hit St Petersburg gas terminal",6,30,0.5
"3594",8,"Ukraine says it shot down Russian spy plane",6,30,0.5
"3595",8,"Unseen images of computer that helped win WW2",6,30,0.5
"3596",8,"US and UK strikes fail to slow Houthi attacks",6,30,0.5
"3597",8,"US launches Boeing investigation after blowout",6,30,0.5
"3598",8,"US official says Boeing jets won't fly until safe",6,30,0.5
"3599",8,"US recall says Tesla brake warnings were too small",6,30,0.5
"3600",8,"William to return to work after Kate's surgery",6,30,0.5
"3601",8,"World's largest cruise ship sets sail from Miami",6,30,0.5
"3602",8,"Zuckerberg apologises to families in fiery Senate hearing",6,30,0.5
"3603",9,"Alarming 30-fold rise in measles in Europe - WHO",6,30,0.5
"3604",9,"Arrest after death of US art dealer in Brazil",6,30,0.5
"3605",9,"Biden wins in New Hampshire despite ballot no-show",6,30,0.5
"3606",9,"Bills and border crisis drive Trump voters to polls",6,30,0.5
"3607",9,"Boeing admits mistake over plane door blow-out",6,30,0.5
"3608",9,"Caught in a Ugandan propaganda network",6,30,0.5
"3609",9,"Cockpit window crack forces ANA Boeing to turn back",6,30,0.5
"3610",9,"Cyclone brings heavy rain to Mauritius and Réunion",6,30,0.5
"3611",9,"Denmark's cool, Scandi proclamation felt familiar",6,30,0.5
"3612",9,"Ecuador prosecutor probing TV studio attack killed",6,30,0.5
"3613",9,"Elmo responds to 'world is on fire' angst",6,30,0.5
"3614",9,"Female farmer killed as car hits French protesters",6,30,0.5
"3615",9,"Five things in the Biden classified documents report",6,30,0.5
"3616",9,"Foreign residents sue Japan over racial profiling",6,30,0.5
"3617",9,"France to tighten migrant law despite court ruling",6,30,0.5
"3618",9,"French volunteers killed in Russian strike - Macron",6,30,0.5
"3619",9,"German woman goes on trial for lookalike murder",6,30,0.5
"3620",9,"Germans float ban on elected far-right party after scandal",6,30,0.5
"3621",9,"Greek mafia boss killed in hail of bullets",6,30,0.5
"3622",9,"Hobbit first edition found at boot sale for £1.50",6,30,0.5
"3623",9,"Huge galaxy ring challenges thinking on universe",6,30,0.5
"3624",9,"Hunter Biden pleads not guilty to nine tax charges",6,30,0.5
"3625",9,"Indian men conned by 'impregnating women' job scam",6,30,0.5
"3626",9,"Julia Roberts: No nude scenes is my choice",6,30,0.5
"3627",9,"Ketamine stash worth €55m seized in Netherlands",6,30,0.5
"3628",9,"Liberia moves from youngest elected leader to oldest",6,30,0.5
"3629",9,"Massive winter US storm expected to hit millions",6,30,0.5
"3630",9,"Musk moves to shift Tesla's legal home to Texas",6,30,0.5
"3631",9,"N Korea tests 'underwater nuclear weapons system'",6,30,0.5
"3632",9,"Nauru cuts ties with Taiwan in favour of China",6,30,0.5
"3633",9,"Netflix password crackdown fuels sign-up surge",6,30,0.5
"3634",9,"Newborn girl found in bag less than hour old",6,30,0.5
"3635",9,"No sirens - Austin ambulance request in new audio",6,30,0.5
"3636",9,"Notorious Mexican cartel leader 'La Kena' captured",6,30,0.5
"3637",9,"Police search for motive in Illinois mass killing",6,30,0.5
"3638",9,"Prince William can show his own version of royalty",6,30,0.5
"3639",9,"Rare N Korea footage shows teens sentenced over K-drama",6,30,0.5
"3640",9,"Russian oil getting into UK via refinery loophole",6,30,0.5
"3641",9,"Snoop Dogg sues Walmart over cereal sabotage claim",6,30,0.5
"3642",9,"Snowstorms disrupt Lunar New Year travel in China",6,30,0.5
"3643",9,"South Korea’s complicated relationship with dog meat",6,30,0.5
"3644",9,"Suspected Gilgo Beach killer receives fourth charge",6,30,0.5
"3645",9,"Suspected Jordanian air strikes in Syria kill 10",6,30,0.5
"3646",9,"Tough choices for Israel in US's Middle East vision",6,30,0.5
"3647",9,"Ukraine drones hit St Petersburg gas terminal",6,30,0.5
"3648",9,"What do Putin and Carlson gain from the interview?",6,30,0.5
"3649",9,"World's largest cruise ship sets sail from Miami",6,30,0.5
"3650",9,"Yemen strikes show war in Gaza has already spread",6,30,0.5
"3651",10,"Bafta Film Awards 2024: The nominees in full",6,30,0.5
"3652",10,"Bali bomb families face accused at Guantanamo Bay",6,30,0.5
"3653",10,"Biden says US strikes have not stopped Houthi attacks",6,30,0.5
"3654",10,"Billionaire Lewis pleads guilty to insider trading",6,30,0.5
"3655",10,"Brazil's ex-leader Bolsonaro to have passport seized",6,30,0.5
"3656",10,"Clapham suspect died in Thames, police believe",6,30,0.5
"3657",10,"Dad's Army star Ian Lavender dies aged 77",6,30,0.5
"3658",10,"Dancer with allergy eats mislabelled cookie and dies",6,30,0.5
"3659",10,"Democrat leaves hospital to cast vital impeachment vote",6,30,0.5
"3660",10,"DPD error caused chatbot to swear at customer",6,30,0.5
"3661",10,"Eight US deaths in Colombia linked to dating apps",6,30,0.5
"3662",10,"EU leaders unlock €50bn support package for Ukraine",6,30,0.5
"3663",10,"Ex-Abercrombie CEO denies sex trafficking allegations",6,30,0.5
"3664",10,"Exciting new cancer drug kinder than chemotherapy",6,30,0.5
"3665",10,"Former pole vault world champion Barber dies aged 29",6,30,0.5
"3666",10,"Georgia prosecutors in Trump case admit affair",6,30,0.5
"3667",10,"German far-right seeks to piggyback on farmer protests",6,30,0.5
"3668",10,"Haley and DeSantis face-off in last Republican debate",6,30,0.5
"3669",10,"I was taken by surprise on £1,000 Rwanda bet - PM",6,30,0.5
"3670",10,"Indian player sparks conversation on sexism in chess",6,30,0.5
"3671",10,"Israel footballer faces Turkey sack for hostage plea",6,30,0.5
"3672",10,"Italian influencers to be bound by tighter rules",6,30,0.5
"3673",10,"Judge annuls Musk's 'unfathomable' $56bn Tesla pay",6,30,0.5
"3674",10,"Julia Roberts: No nude scenes is my choice",6,30,0.5
"3675",10,"Kenya court blocks police deployment to Haiti",6,30,0.5
"3676",10,"Kylie, Billie, Joni and Beatles win early Grammys",6,30,0.5
"3677",10,"Lauren Boebert's ex-husband arrested in Colorado",6,30,0.5
"3678",10,"Maldives ultimatum on troops deepens row with India",6,30,0.5
"3679",10,"Mauritius assesses damage after Cyclone Belal",6,30,0.5
"3680",10,"Missing China billionaire banker quits all roles",6,30,0.5
"3681",10,"Pakistan-Iran diplomatic ties restored after strikes",6,30,0.5
"3682",10,"Post Office threatened BBC over whistleblower",6,30,0.5
"3683",10,"Pressure grows on Kosovo's Serbs with currency curb",6,30,0.5
"3684",10,"Prince William can show his own version of royalty",6,30,0.5
"3685",10,"Run-DMC DJ shot by godson for revenge, court told",6,30,0.5
"3686",10,"Six-legged dog has operation to remove extra limbs",6,30,0.5
"3687",10,"Snoop Dogg’s daughter speaks of shock after stroke",6,30,0.5
"3688",10,"Snowstorms disrupt Lunar New Year travel in China",6,30,0.5
"3689",10,"Spain police bust gang of alleged ex-military robbers",6,30,0.5
"3690",10,"US man says wait for untested execution like 'torture'",6,30,0.5
"3691",10,"US woman gets 26 years for mother's 'suitcase murder'",6,30,0.5
"3692",10,"War in Yemen: UAE funded political assassinations",6,30,0.5
"3693",10,"What does it mean for William, Harry and the other royals?",6,30,0.5
"3694",10,"William says public sympathy 'means a great deal'",6,30,0.5
"3695",10,"World breaches 1.5C warming threshold for full year",6,30,0.5
"3696",1,"Alabama carries out first nitrogen gas execution",5,25,0.416666666666667
"3697",1,"Bolts missing from door, says Boeing blowout probe",5,25,0.416666666666667
"3698",1,"Hunter Biden pleads not guilty to nine tax charges",5,25,0.416666666666667
"3699",1,"Pakistan ex-PM Imran Khan jailed another 14 years",5,25,0.416666666666667
"3700",1,"Pakistan launches missile strikes into Iran",5,25,0.416666666666667
"3701",1,"Police response to Uvalde was a failure, DOJ says",5,25,0.416666666666667
"3702",1,"Russian state media revels in Tucker Carlson visit",5,25,0.416666666666667
"3703",1,"Tough choices for Israel in US's Middle East vision",5,25,0.416666666666667
"3704",1,"UK to loan back Ghana's looted 'crown jewels'",5,25,0.416666666666667
"3705",1,"UN court hears genocide case against Israel",5,25,0.416666666666667
"3706",2,"Brunei's 'hot prince' formally marries in ceremony",5,25,0.416666666666667
"3707",2,"Jury starts deliberating in Trump defamation trial",5,25,0.416666666666667
"3708",2,"Kylie, Billie Eilish and Beatles win early Grammys",5,25,0.416666666666667
"3709",2,"Namibia gets new leader hours after predecessor dies",5,25,0.416666666666667
"3710",2,"Nigerian monarch shot dead and wife kidnapped",5,25,0.416666666666667
"3711",2,"Pakistan launches retaliatory strikes into Iran",5,25,0.416666666666667
"3712",2,"Putin interview released by ex-Fox host Tucker Carlson",5,25,0.416666666666667
"3713",2,"S Africa president axes adviser as PhD questioned",5,25,0.416666666666667
"3714",2,"Shock as Hunter Biden attends House contempt hearing",5,25,0.416666666666667
"3715",2,"Taiwan elects pro-sovereign William Lai, angering Beijing",5,25,0.416666666666667
"3716",2,"Taiwan elects William Lai president in historic vote",5,25,0.416666666666667
"3717",3,"BBC confronts man who abused boy in secretive Christian church",5,25,0.416666666666667
"3718",3,"BBC releases emails about Bashir's Diana interview",5,25,0.416666666666667
"3719",3,"Footage released of Clapham attack suspect search",5,25,0.416666666666667
"3720",3,"Greek ship hit by Houthi missile in Red Sea",5,25,0.416666666666667
"3721",3,"Haley vows to fight on after second loss to Trump",5,25,0.416666666666667
"3722",3,"Houthis claim hit on US container ship in Red Sea",5,25,0.416666666666667
"3723",3,"Pentagon chief apologises for secretive hospital stay",5,25,0.416666666666667
"3724",3,"Russian oil getting into UK via refinery loophole",5,25,0.416666666666667
"3725",3,"The Taiwan that China wants is vanishing",5,25,0.416666666666667
"3726",3,"Trump and Haley to go head-to-head in New Hampshire",5,25,0.416666666666667
"3727",3,"US drone kills Iran-backed militia leader in Baghdad",5,25,0.416666666666667
"3728",3,"Woman arrested after pet lion taken on car ride",5,25,0.416666666666667
"3729",4,"'Toy poodles' on the Moon: Japan lander gets to work",5,25,0.416666666666667
"3730",4,"AI to hit 40% of jobs and worsen inequality, IMF says",5,25,0.416666666666667
"3731",4,"Boy with IQ of 162 says football comes first",5,25,0.416666666666667
"3732",4,"China fury as Messi plays after missing Hong Kong game",5,25,0.416666666666667
"3733",4,"Eight US deaths in Colombia linked to dating apps",5,25,0.416666666666667
"3734",4,"Greta Thunberg: We must remember who real enemy is",5,25,0.416666666666667
"3735",4,"King Charles to be treated for benign prostate condition",5,25,0.416666666666667
"3736",4,"UK halts aid to UN agency after Hamas attack claim",5,25,0.416666666666667
"3737",4,"US drone kills Iran-backed militia leader in Baghdad",5,25,0.416666666666667
"3738",4,"Woman arrested for stealing $2,500 of Stanley cups",5,25,0.416666666666667
"3739",4,"Woman killed by dogs while visiting grandson",5,25,0.416666666666667
"3740",4,"World tops 1.5C warming threshold for full year",5,25,0.416666666666667
"3741",5,"Clapham suspect convicted of sex offence in 2018",5,25,0.416666666666667
"3742",5,"Duchess of York diagnosed with skin cancer",5,25,0.416666666666667
"3743",5,"Grammys 2024: The highs, lows and why Swift won",5,25,0.416666666666667
"3744",5,"Hostages taken at US plant in Turkey - reports",5,25,0.416666666666667
"3745",5,"Hunter Biden pleads not guilty to nine tax charges",5,25,0.416666666666667
"3746",5,"Iran-aligned group suspends attacks against US",5,25,0.416666666666667
"3747",5,"Israel says 24 soldiers killed in Gaza in one day",5,25,0.416666666666667
"3748",5,"Man jailed for 50 years for defaming Thai monarchy",5,25,0.416666666666667
"3749",5,"Moments before US boy, 11, shot by police revealed",5,25,0.416666666666667
"3750",5,"Nearly 90 dead after fierce winter storms strike US",5,25,0.416666666666667
"3751",5,"Oppenheimer eclipses Barbie in Bafta nominations",5,25,0.416666666666667
"3752",5,"Russian sanctioned for Australia's worst data hack",5,25,0.416666666666667
"3753",5,"Scientists clone monkey to speed medical research",5,25,0.416666666666667
"3754",5,"Stunning shot of polar bear drifting to sleep wins award",5,25,0.416666666666667
"3755",5,"Swedish police destroy object outside Israeli embassy",5,25,0.416666666666667
"3756",5,"Tom Holland bonus sent to Tom Hollander in error",5,25,0.416666666666667
"3757",5,"Trump 'unleashed' followers on Carroll, says lawyer",5,25,0.416666666666667
"3758",5,"UK to loan back Ghana's looted 'crown jewels'",5,25,0.416666666666667
"3759",5,"Ukraine MPs reject bid to crack down on draft dodgers",5,25,0.416666666666667
"3760",5,"UN's top court says Israel must prevent genocide",5,25,0.416666666666667
"3761",5,"US Marines helicopter missing with five on board",5,25,0.416666666666667
"3762",5,"What is the genocide case against Israel?",5,25,0.416666666666667
"3763",6,"'Critical failure' grounds Blinken plane in Davos",5,25,0.416666666666667
"3764",6,"'I just love you': Trump challengers fall in line",5,25,0.416666666666667
"3765",6,"'Send back our husbands' - Russian women in rare protest",5,25,0.416666666666667
"3766",6,"Alarming 45-fold rise in measles in Europe - WHO",5,25,0.416666666666667
"3767",6,"Biden says strikes against Yemen will continue",5,25,0.416666666666667
"3768",6,"Billionaire Lewis pleads guilty to insider trading",5,25,0.416666666666667
"3769",6,"Boeing admits mistake over plane door blow-out",5,25,0.416666666666667
"3770",6,"Bolts missing from door, says Boeing blowout probe",5,25,0.416666666666667
"3771",6,"Caught in a Ugandan propaganda network",5,25,0.416666666666667
"3772",6,"Dad's Army star Ian Lavender dies aged 77",5,25,0.416666666666667
"3773",6,"E Jean Carroll says Trump shattered her reputation",5,25,0.416666666666667
"3774",6,"Emma Stone: Sex scenes in Poor Things are 'honest'",5,25,0.416666666666667
"3775",6,"Georgia prosecutors in Trump case admit affair",5,25,0.416666666666667
"3776",6,"Grammy Awards: The main winners as they happen",5,25,0.416666666666667
"3777",6,"Kenya gas blast kills three and injures nearly 300",5,25,0.416666666666667
"3778",6,"Klopp to leave as Liverpool boss at end of season",5,25,0.416666666666667
"3779",6,"Kylie, Billie, Joni and Beatles win early Grammys",5,25,0.416666666666667
"3780",6,"Rare N Korea footage shows teens sentenced over K-drama",5,25,0.416666666666667
"3781",6,"Rio declares health emergency days before Carnival",5,25,0.416666666666667
"3782",6,"Spain's congress rejects Catalan separatists bill",5,25,0.416666666666667
"3783",6,"UN's top court to rule on Israel in Gaza war",5,25,0.416666666666667
"3784",6,"Who is Bushra Bibi, the faith healer wife of Imran Khan?",5,25,0.416666666666667
"3785",6,"Zimbabwe opposition leader quits 'contaminated' party",5,25,0.416666666666667
"3786",7,"A political hand grenade disguised as a report",5,25,0.416666666666667
"3787",7,"A TikTok grandpa with a bloody past is trying to win an election",5,25,0.416666666666667
"3788",7,"Billionaire Lewis pleads guilty to insider trading",5,25,0.416666666666667
"3789",7,"Canada sets two-year cap on foreign students",5,25,0.416666666666667
"3790",7,"Caught in a Ugandan propaganda network",5,25,0.416666666666667
"3791",7,"Chaos and 'lack of urgency' led to Uvalde failures",5,25,0.416666666666667
"3792",7,"Drone strike kills Iran-aligned militia leader in Iraq",5,25,0.416666666666667
"3793",7,"Germans float ban on elected far-right party after scandal",5,25,0.416666666666667
"3794",7,"Harry settles phone-hacking case with Mirror group",5,25,0.416666666666667
"3795",7,"Houthis claim hit on US container ship in Red Sea",5,25,0.416666666666667
"3796",7,"Iran extends Nobel Prize winner's prison sentence",5,25,0.416666666666667
"3797",7,"Iran: Air strike on Syria will not go 'unanswered'",5,25,0.416666666666667
"3798",7,"Is North Korea's leader actually considering war?",5,25,0.416666666666667
"3799",7,"Japan lands on Moon but glitch threatens mission",5,25,0.416666666666667
"3800",7,"Mother of killed Israeli calls Hamas videos 'psychological warfare'",5,25,0.416666666666667
"3801",7,"Netanyahu publicly rejects US push for Palestinian state",5,25,0.416666666666667
"3802",7,"Six held over plot to disrupt London Stock Exchange",5,25,0.416666666666667
"3803",7,"Spectacular arches, caves as monster iceberg decays",5,25,0.416666666666667
"3804",7,"Top Palestinian envoy says UK guilty of hypocrisy",5,25,0.416666666666667
"3805",7,"Trump, Haley and DeSantis make final pitches in frozen Iowa",5,25,0.416666666666667
"3806",7,"US strikes Iran-backed militia in Iraq",5,25,0.416666666666667
"3807",7,"Victorious Nigerians taunt South Africans with Tyla hit",5,25,0.416666666666667
"3808",7,"William visits Kate in hospital after surgery",5,25,0.416666666666667
"3809",8,"Alec Baldwin charged again in fatal Rust shooting",5,25,0.416666666666667
"3810",8,"Captain Cook statue sawn off ahead of Australia Day",5,25,0.416666666666667
"3811",8,"Caught in a Ugandan propaganda network",5,25,0.416666666666667
"3812",8,"Chaos and 'lack of urgency' led to Uvalde failures",5,25,0.416666666666667
"3813",8,"Civilians dead in Russia strikes on Kyiv and Kharkiv",5,25,0.416666666666667
"3814",8,"El Salvador woman freed after abortion conviction",5,25,0.416666666666667
"3815",8,"Elon Musk funds Gina Carano lawsuit against Disney",5,25,0.416666666666667
"3816",8,"Exciting new cancer drug kinder than chemotherapy",5,25,0.416666666666667
"3817",8,"First Russia-Ukraine prisoner swap since plane crash",5,25,0.416666666666667
"3818",8,"Ketamine stash worth €55m seized in Netherlands",5,25,0.416666666666667
"3819",8,"Maignan and Milan walk off after alleged racist abuse",5,25,0.416666666666667
"3820",8,"Margot Robbie comments on best actress Oscar snub",5,25,0.416666666666667
"3821",8,"Melania Trump's mother Amalija Knavs dies at 78",5,25,0.416666666666667
"3822",8,"Pakistan launches retaliatory strikes into Iran",5,25,0.416666666666667
"3823",8,"Police search for motive in Illinois mass killing",5,25,0.416666666666667
"3824",8,"Prince Harry to visit King Charles in coming days",5,25,0.416666666666667
"3825",8,"The new-style nightclub that's only open in the day",5,25,0.416666666666667
"3826",8,"Trump and Haley to go head-to-head in New Hampshire",5,25,0.416666666666667
"3827",8,"Universal Music to pull songs from TikTok",5,25,0.416666666666667
"3828",8,"US convicts Russian man who flew to LA without passport",5,25,0.416666666666667
"3829",8,"US drone kills Iran-backed militia leader in Baghdad",5,25,0.416666666666667
"3830",8,"US will not support unplanned Rafah offensive",5,25,0.416666666666667
"3831",8,"US woman gets 26 years for mother's 'suitcase murder'",5,25,0.416666666666667
"3832",8,"Western officials in protest over Israel Gaza policy",5,25,0.416666666666667
"3833",8,"Where Biden v Trump will be won and lost",5,25,0.416666666666667
"3834",8,"Why is Alabama executing a man using nitrogen gas?",5,25,0.416666666666667
"3835",8,"Yemen strikes show war in Gaza has already spread",5,25,0.416666666666667
"3836",9,"'I can't see': Witnesses recount 'horrific' scene in south London",5,25,0.416666666666667
"3837",9,"'Send back our husbands' - Russian women in rare protest",5,25,0.416666666666667
"3838",9,"Alarming 45-fold rise in measles in Europe - WHO",5,25,0.416666666666667
"3839",9,"Billionaire Lewis pleads guilty to insider trading",5,25,0.416666666666667
"3840",9,"Brianna killers given life terms for brutal murder",5,25,0.416666666666667
"3841",9,"Cancer doctor takes gamble to treat his brain tumour",5,25,0.416666666666667
"3842",9,"DPD error caused chatbot to swear at customer",5,25,0.416666666666667
"3843",9,"EU leaders unlock €50bn support package for Ukraine",5,25,0.416666666666667
"3844",9,"Explosives held by illegal miners rock Nigeria city",5,25,0.416666666666667
"3845",9,"Grammy Awards: The main winners and nominees",5,25,0.416666666666667
"3846",9,"Judge annuls Musk's 'unfathomable' $56bn Tesla pay",5,25,0.416666666666667
"3847",9,"King Charles to be treated for benign prostate condition",5,25,0.416666666666667
"3848",9,"King doing 'extremely well' after diagnosis - Queen",5,25,0.416666666666667
"3849",9,"Maine father drowns in icy pond after saving son",5,25,0.416666666666667
"3850",9,"Man held for murder over South Africa building fire",5,25,0.416666666666667
"3851",9,"Microsoft says AI is getting deployed 'at scale'",5,25,0.416666666666667
"3852",9,"Mother convicted for failing to stop school shooting",5,25,0.416666666666667
"3853",9,"Myanmar's army is losing - and facing fire from a militant monk",5,25,0.416666666666667
"3854",9,"Nikki Haley suffers stinging defeat in Nevada",5,25,0.416666666666667
"3855",9,"Parents of Grand Canyon crash victim to get £79m",5,25,0.416666666666667
"3856",9,"Queen died peacefully and without pain, book says",5,25,0.416666666666667
"3857",9,"SA gospel singer accused of ordering lover's murder",5,25,0.416666666666667
"3858",9,"Spain's congress rejects Catalan separatists bill",5,25,0.416666666666667
"3859",9,"Stars gear up for Emmy Awards after strike delay",5,25,0.416666666666667
"3860",9,"Student jailed for fiance's car drag death",5,25,0.416666666666667
"3861",9,"The Taiwan that China wants is vanishing",5,25,0.416666666666667
"3862",9,"US convicts Russian man who flew to LA without passport",5,25,0.416666666666667
"3863",9,"US voters react to Trump's commanding Iowa win",5,25,0.416666666666667
"3864",10,"'Almost like an invite': why so many migrants head for US",5,25,0.416666666666667
"3865",10,"'Drugged, robbed, killed': One city's deadly dating trap",5,25,0.416666666666667
"3866",10,"At least 112 killed in Chile wildfires",5,25,0.416666666666667
"3867",10,"At least eight dead after Papua New Guinea rioting",5,25,0.416666666666667
"3868",10,"Canada weighs capping foreign student admissions",5,25,0.416666666666667
"3869",10,"China tightens stock market rules after sell-off",5,25,0.416666666666667
"3870",10,"Chinese ship's port call fans India tensions",5,25,0.416666666666667
"3871",10,"Chinese ship's port call flares India tension",5,25,0.416666666666667
"3872",10,"Danish king publishes book three days into reign",5,25,0.416666666666667
"3873",10,"Death in the Channel - what led a boy to make fatal journey?",5,25,0.416666666666667
"3874",10,"Dozens reported killed as Khan Younis battle rages",5,25,0.416666666666667
"3875",10,"German far-right met to plan 'mass deportations'",5,25,0.416666666666667
"3876",10,"Harvard sued over 'rampant anti-Jewish hatred'",5,25,0.416666666666667
"3877",10,"Hostages taken at US plant in Turkey - reports",5,25,0.416666666666667
"3878",10,"Huge blast rocks Nigerian city of Ibadan",5,25,0.416666666666667
"3879",10,"Jason Momoa's 1929 Rolls-Royce car turned electric",5,25,0.416666666666667
"3880",10,"Kinshasa chaos as Congo river hits near-record level",5,25,0.416666666666667
"3881",10,"Maine father drowns in icy pond after saving son",5,25,0.416666666666667
"3882",10,"Man charged with stalking near Taylor Swift's home",5,25,0.416666666666667
"3883",10,"N Korea tests 'underwater nuclear weapons system'",5,25,0.416666666666667
"3884",10,"Net closes in on vigilante destroyer of Italy's speed cameras",5,25,0.416666666666667
"3885",10,"No sirens - Austin ambulance request in new audio",5,25,0.416666666666667
"3886",10,"Republicans back contempt charges for Hunter Biden",5,25,0.416666666666667
"3887",10,"Russia says 28 killed in strike on occupied Ukraine city",5,25,0.416666666666667
"3888",10,"Shocked by far-right revelations, Germans consider ban",5,25,0.416666666666667
"3889",10,"Spanish triple murder linked to online romance scam",5,25,0.416666666666667
"3890",10,"Spears seems to apologise to Timberlake over book",5,25,0.416666666666667
"3891",10,"Trump ordered to pay $83m for defaming E Jean Carroll",5,25,0.416666666666667
"3892",10,"Trump, Haley and DeSantis make final pitches in frozen Iowa",5,25,0.416666666666667
"3893",10,"UK reconsiders relocating ex-Afghan special forces",5,25,0.416666666666667
"3894",10,"Ukraine's missing children traced by digital sleuths",5,25,0.416666666666667
"3895",10,"Ukraine not ruling out PoWs on downed Russian plane",5,25,0.416666666666667
"3896",10,"Ukraine says it shot down Russian spy plane",5,25,0.416666666666667
